{
  "schema_version": 1,
  "device_id": "2c1f2d8e-2bb7-4f58-bb6a-6c2a0f4a7a4c",
  "event_ts": "2026-03-24T10:10:00Z",
  "seq": 1003,
  "metrics": {
    "tilt_x_deg": 0.18,
    "tilt_y_deg": 0.09,
    "battery_pct": 87,
    "warning_flag": false,
    "gps_latitude": 22.684712,
    "gps_longitude": 108.351634,
    "temperature_c": 25.3,
    "humidity_pct": 62.1,
    "signal_rssi_dbm": -78,
    "signal_snr_db": 7.2,
    "vibration_x_g": 0.01,
    "vibration_y_g": 0.02,
    "vibration_z_g": 1.01,
    "accel_peak_g": 1.06,
    "link_retry_count": 3,
    "supply_voltage_v": 3.92
  },
  "meta": {
    "packet_class": "hf_oversized",
    "reason": "budget_test",
    "note": "This sample intentionally exceeds the recommended high-frequency budget and should be treated as a rejection or downgrade candidate."
  }
}
