{
  "schema_version": 1,
  "device_id": "2c1f2d8e-2bb7-4f58-bb6a-6c2a0f4a7a4c",
  "event_ts": "2026-03-24T10:05:00Z",
  "seq": 1002,
  "metrics": {
    "temperature_c": 25.3,
    "humidity_pct": 62.1,
    "battery_pct": 87
  },
  "meta": {
    "packet_class": "lf_meta",
    "fw": "rk2206-sim-0.1.0",
    "sampling_s": 5,
    "report_interval_s": 30
  }
}
