{
  "schema_version": 1,
  "device_id": "2c1f2d8e-2bb7-4f58-bb6a-6c2a0f4a7a4c",
  "event_ts": "2025-12-15T10:00:00Z",
  "seq": 12345,
  "metrics": {
    "displacement_mm": 1.23,
    "tilt_x_deg": 0.18,
    "tilt_y_deg": 0.02,
    "rainfall_mm_h": 12.5,
    "battery_v": 3.92,
    "device_mode": "normal",
    "relay_1": false
  },
  "meta": {
    "fw": "1.0.0",
    "sampling_s": 5,
    "report_interval_s": 5
  }
}
