{
  "schema_version": 1,
  "device_id": "00000000-0000-0000-0000-000000000001",
  "event_ts": null,
  "seq": 21,
  "metrics": {
    "temperature_c": 29.5,
    "humidity_pct": 50.1,
    "accel_x_g": 0.09,
    "accel_y_g": 0.06,
    "accel_z_g": 1.0,
    "gyro_x_dps": 0.5,
    "gyro_y_dps": -0.3,
    "gyro_z_dps": 0.1,
    "tilt_x_deg": 5.12,
    "tilt_y_deg": 3.39,
    "gps_latitude": 22.5432,
    "gps_longitude": 114.058098,
    "battery_pct": 80,
    "warning_flag": true
  },
  "meta": {
    "install_label": "FIELD-NODE-A",
    "legacy_node": "A",
    "uptime_s": 109,
    "last_command_type": "",
    "last_command_id": "",
    "last_command_uptime_s": 0,
    "upload_trigger": "periodic",
    "legacy_valid_flags": {
      "temp_ok": 1,
      "imu_ok": 1,
      "gps_ok": 1
    }
  }
}
